{
  "schema": "intent.knowledge-record.v2",
  "kind": "check",
  "id": "check.example",
  "status": "current",
  "owners": [
    "example-owner"
  ],
  "sources": [],
  "relationships": [],
  "conflicts": [],
  "tags": [],
  "subjects": [
    {
      "kind": "file",
      "selector": "future/not-implemented.mjs"
    }
  ],
  "evidenceKinds": [
    "command"
  ]
}
